{
  "schema_version": "1.0.0",
  "method_id": "iid_structure_component_bench_v1",
  "seed": 2026110022,
  "missingness_seed": 2026110023,
  "markers_per_autosome": 64,
  "pure_per_group": 40,
  "admixed_count": 24,
  "rare_count": 4,
  "projected_per_group": 8,
  "projected_rare_count": 4,
  "frequencies": [0.2, 0.8],
  "missingness_fraction": 0.05,
  "relative_tolerance": 1e-8,
  "absolute_tolerance": 1e-9,
  "confidence_level": 0.95,
  "target_configuration": "d19_technical_target_v1.json",
  "target_configuration_sha256": "c316c57a432ed7ed53cfc8fe99cad9c7ec0489115e1c5ea19523c677d5857bc5",
  "plink_executable": "plink",
  "manual_approval": {
    "approved": true,
    "decision_id": "CAL-DEC-006",
    "reviewer_role": "calibration_owner",
    "approved_at": "2026-10-30T07:00:00Z"
  },
  "fixture_review_policy": {
    "reviewer_role": "calibration_contract_fixture",
    "reviewed_at": "2026-10-30T07:00:00Z",
    "scope": "SYNTHETIC_D22_ONLY_NOT_SCIENTIFIC_APPROVAL"
  },
  "population_parameters": {
    "requested_components": 3,
    "outlier_components": 2,
    "outlier_alpha": 0.01,
    "min_reference_samples": 20,
    "min_informative_variants": 100,
    "min_reference_call_rate": 0.9,
    "plink_timeout_seconds": 300
  }
}
